,comment_id,submission_id,user,utc,score,body
0,emqj2yu,t3_blq1cm,Herobrineajb,1557235239.0,4,Watch out! I think he’s making a bomb.
1,empbjbz,t3_bleula,TotesMessenger,1557196440.0,1,"I'm a bot, *bleep*, *bloop*. Someone has linked to this thread from another place on reddit:

- [/r/flatearth] [Makes sense](https://www.reddit.com/r/flatearth/comments/bljgx2/makes_sense/)

- [/r/flatearthmemes] [Explain this!](https://www.reddit.com/r/FlatEarthMemes/comments/bll7sq/explain_this/)

&nbsp;*^(If you follow any of the above links, please respect the rules of reddit and don't vote in the other threads.) ^\([Info](/r/TotesMessenger) ^/ ^[Contact](/message/compose?to=/r/TotesMessenger))*"
2,emnr928,t3_blem8i,I_Lost_hope,1557161759.0,2,This may be brainwashing many children so please watch with caution
3,emqb24z,t3_blem8i,Herobrineajb,1557229361.0,2,"They are literally encouraging kids to kill people who have values we don’t understand. Like when I didn’t want to vaccinate my kids, the government killed them with a genetically engineered measles virus. That’s not my fault!"
4,emd6on6,t3_bk1g4s,I_Lost_hope,1556842538.0,2,Is this why my son turned gay this is absolutely redonculus
5,emc7ljk,t3_bjye2t,TotesMessenger,1556822134.0,1,"I'm a bot, *bleep*, *bloop*. Someone has linked to this thread from another place on reddit:

- [/r/birdsarentreal] [My theory](https://www.reddit.com/r/BirdsArentReal/comments/bjye8q/my_theory/)

&nbsp;*^(If you follow any of the above links, please respect the rules of reddit and don't vote in the other threads.) ^\([Info](/r/TotesMessenger) ^/ ^[Contact](/message/compose?to=/r/TotesMessenger))*"
6,emb9kwh,t3_bjumym,I_Lost_hope,1556801984.0,3,Wait did they infiltrate our systems everyone act normal
7,emb86zu,t3_bjuado,ryanarp11,1556801052.0,2,devastating
8,embdljs,t3_bjuado,Herobrineajb,1556804590.0,1,Someone x-post to r/fightporn
9,em84xrv,t3_bjhfya,I_Lost_hope,1556720195.0,2,hmm very interesting philosophy my good sir yes that could be very likely as you suggested
10,em9b3b3,t3_bjh3y7,Herobrineajb,1556744059.0,1,Cats are pretty sketchy as well...
11,em661pg,t3_bj5t7v,N1602A,1556658789.0,3,It’s Samsung what do you expect?
12,em59e38,t3_bj4o3c,ryanarp11,1556639397.0,2,They're catching onto us
13,em90rmj,t3_bj4o3c,marra101,1556738308.0,1,Standard mark ll surveillance drone actually quite harmless
14,em563a9,t3_bj45ck,N1602A,1556637280.0,3,Mine fell off and now I have the cancer.
15,em53p2t,t3_bj45ck,I_Lost_hope,1556635712.0,2,Thanks for always looking out for us
16,em53cqd,t3_bj442v,I_Lost_hope,1556635485.0,6,Wow I didn’t think about this that way. You got some really valid points here
17,em7w7aq,t3_bj442v,TotesMessenger,1556714247.0,3,"I'm a bot, *bleep*, *bloop*. Someone has linked to this thread from another place on reddit:

- [/r/flatearth] [Think about it](https://www.reddit.com/r/flatearth/comments/bjgk3a/think_about_it/)

- [/r/flatearthmemes] [Something to consider](https://www.reddit.com/r/FlatEarthMemes/comments/bjggdf/something_to_consider/)

&nbsp;*^(If you follow any of the above links, please respect the rules of reddit and don't vote in the other threads.) ^\([Info](/r/TotesMessenger) ^/ ^[Contact](/message/compose?to=/r/TotesMessenger))*"
18,em52ac9,t3_bj3zj0,Inski-binski,1556634765.0,3,Oh god scawy
19,em681w5,t3_bj3dta,N1602A,1556659998.0,3,Guys is that an i8-6900x?
20,em518sy,t3_bj3dta,ryanarp11,1556634057.0,2,This is absolutely unbelievable
21,em91j2j,t3_bj3dta,marra101,1556738756.0,2,You seem to have missed the internal self destruct device which activates when cover is blown or even suspected. Known actions include flying into vehicles or flying into a known area populated by felines
